Attraction Name,Park Name,Timings,Height Restrictions,Location Lat,Location Lng
Meet Donald Duck in Mexico,EPCOT,"09:30:00 to 09:30:00, 10:00:00 to 10:00:00, 10:30:00 to 10:30:00, 11:00:00 to 11:00:00, 11:30:00 to 11:30:00, 12:00:00 to 12:00:00, 12:30:00 to 12:30:00, 14:10:00 to 14:10:00, 14:40:00 to 14:40:00, 15:10:00 to 15:10:00, 15:40:00 to 15:40:00, 16:10:00 to 16:10:00",,28.371185,-81.547297
Raglan Road Live Entertainment,,,,28.371143,-81.517783
Atlantic Dance Hall,Disney's BoardWalk,20:00:00 to 01:00:00,,28.367668,-81.5579
Meet Moana at Character Landing,Disney's Animal Kingdom Theme Park,"08:30:00 to 11:30:00, 13:30:00 to 15:45:00",,28.357086,-81.589374
Springs Overlook,Disney Springs,,,28.370383,-81.517411
Command Performance,EPCOT,"15:00:00 to 15:00:00, 16:15:00 to 16:15:00, 17:30:00 to 17:30:00, 19:00:00 to 19:00:00, 20:00:00 to 20:00:00",,28.370535,-81.552498
Fireworks & Nighttime Entertainment,,,,,
Mickey's Magical Friendship Faire,Magic Kingdom Park,"10:00:00 to 10:00:00, 11:10:00 to 11:10:00, 12:50:00 to 12:50:00, 13:55:00 to 13:55:00, 16:00:00 to 16:00:00",,28.419169,-81.581204
Meet Edna Mode at the Edna Mode Experience,Disney's Hollywood Studios,09:00:00 to 17:00:00,['any-height'],28.356086,-81.560742
Indiana Jones™ Epic Stunt Spectacular!,Disney's Hollywood Studios,"10:45:00 to 10:45:00, 12:00:00 to 12:00:00, 13:15:00 to 13:15:00, 15:15:00 to 15:15:00, 16:30:00 to 16:30:00",,28.3566701,-81.558611
Meet Figment Inside ImageWorks,EPCOT,"09:00:00 to 12:30:00, 13:45:00 to 15:45:00",,28.372769,-81.55128
Disney Movie Magic,Disney's Hollywood Studios,20:40:00 to 20:40:00,,28.356965,-81.560425
For the First Time in Forever: A Frozen Sing-Along Celebration,Disney's Hollywood Studios,"09:30:00 to 09:30:00, 10:30:00 to 10:30:00, 11:30:00 to 11:30:00, 12:30:00 to 12:30:00, 13:30:00 to 13:30:00, 14:30:00 to 14:30:00, 15:30:00 to 15:30:00, 16:30:00 to 16:30:00, 17:30:00 to 17:30:00, 18:30:00 to 18:30:00",,28.3568243,-81.559694
Drawn to Life Presented by Cirque du Soleil® & Disney,Disney Springs,"13:30:00 to 13:30:00, 16:00:00 to 16:00:00",['any-height'],28.370719,-81.522536
Disney Junior Play and Dance!,Disney's Hollywood Studios,"09:55:00 to 09:55:00, 10:35:00 to 10:35:00, 11:15:00 to 11:15:00, 11:55:00 to 11:55:00, 12:35:00 to 12:35:00, 14:10:00 to 14:10:00, 14:50:00 to 14:50:00, 15:30:00 to 15:30:00, 16:15:00 to 16:15:00, 16:55:00 to 16:55:00",,28.357613,-81.560567
Jellyrolls,Disney's BoardWalk,19:00:00 to 01:45:00,,28.3673864,-81.557736
Meet Disney Friends Near EPCOT Main Entrance,EPCOT,,,28.375567,-81.549695
Meet Peter Pan in Fantasyland,,"11:35:00 to 11:35:00, 13:20:00 to 13:20:00, 14:20:00 to 14:20:00, 15:30:00 to 15:30:00, 16:25:00 to 16:25:00",,,
Meet Joy Inside ImageWorks,EPCOT,"10:30:00 to 14:00:00, 15:10:00 to 17:40:00",,28.372649,-81.551259
Disney's Animal Kingdom Entertainment,Disney's Animal Kingdom Theme Park,,,28.357994,-81.590597
Meet Ariel at Walt Disney Presents,Disney's Hollywood Studios,09:00:00 to 16:30:00,,28.356945,-81.560998
EPCOT International Flower & Garden Festival – Garden Rocks Concert Series,EPCOT,"17:30:00 to 17:30:00, 18:45:00 to 18:45:00, 20:00:00 to 20:00:00",,28.36831,-81.549428
Star Wars Launch Bay: BB-8 Astromech on Duty,Disney's Hollywood Studios,10:00:00 to 18:00:00,,28.3580201699138,-81.5610394270006
Meet Cinderella and a Visiting Princess at Princess Fairytale Hall,Magic Kingdom Park,09:00:00 to 21:00:00,,28.420071,-81.580893
Meet Olaf at Celebrity Spotlight,Disney's Hollywood Studios,09:00:00 to 18:00:00,,28.356072,-81.559158
Meet Princess Jasmine in Morocco,EPCOT,"09:30:00 to 09:30:00, 10:45:00 to 10:45:00, 11:55:00 to 11:55:00, 13:50:00 to 13:50:00, 15:00:00 to 15:00:00",,28.36798002,-81.5518429
Entertainment at Canada Mill Stage,EPCOT,"14:15:00 to 14:15:00, 15:30:00 to 15:30:00, 17:00:00 to 17:00:00, 18:15:00 to 18:15:00, 19:30:00 to 19:30:00",,28.371202,-81.551509
Let the Magic Begin,Magic Kingdom Park,07:55:00 to 07:55:00,,28.419169,-81.581204
Meet Winnie the Pooh and Tigger at The Thotful Spot,Magic Kingdom Park,"10:00:00 to 10:00:00, 10:30:00 to 10:30:00, 11:00:00 to 11:00:00, 11:30:00 to 11:30:00, 12:00:00 to 12:00:00, 12:30:00 to 12:30:00, 13:00:00 to 13:00:00, 15:00:00 to 15:00:00, 15:30:00 to 15:30:00, 16:00:00 to 16:00:00, 16:30:00 to 16:30:00",,28.4201575,-81.580128
Meet Snow White in Germany,EPCOT,"09:30:00 to 09:30:00, 10:45:00 to 10:45:00, 11:55:00 to 11:55:00, 13:50:00 to 13:50:00, 15:00:00 to 15:00:00",,28.368451,-81.546664
Festival of the Lion King,Disney's Animal Kingdom Theme Park,"10:00:00 to 10:00:00, 11:00:00 to 11:00:00, 12:00:00 to 12:00:00, 13:00:00 to 13:00:00, 14:00:00 to 14:00:00, 15:00:00 to 15:00:00, 16:00:00 to 16:00:00, 17:00:00 to 17:00:00, 18:00:00 to 18:00:00",,28.35811,-81.592643
EPCOT International Festival of the Arts: DISNEY ON BROADWAY Concert Series,EPCOT,,,28.36831,-81.549428
Meet Alice in the United Kingdom,EPCOT,"09:00:00 to 09:00:00, 10:15:00 to 10:15:00, 11:25:00 to 11:25:00, 13:20:00 to 13:20:00, 14:30:00 to 14:30:00",,28.370387,-81.551932
Character Greeting near Buzz Lightyear's Star Command,Magic Kingdom Park,,,28.4178699,-81.5792335
Tam Tam Drummers of Harambe,Disney's Animal Kingdom Theme Park,"10:15:00 to 10:15:00, 11:15:00 to 11:15:00, 12:15:00 to 12:15:00, 13:15:00 to 13:15:00, 14:15:00 to 14:15:00, 15:15:00 to 15:15:00, 16:15:00 to 16:15:00",,28.35873,-81.591928
Finding Nemo: The Big Blue... and Beyond!,Disney's Animal Kingdom Theme Park,"11:00:00 to 11:00:00, 12:00:00 to 12:00:00, 13:00:00 to 13:00:00, 14:30:00 to 14:30:00, 15:30:00 to 15:30:00, 16:30:00 to 16:30:00",,28.357401,-81.587455
JAMMitors,EPCOT,"09:30:00 to 09:30:00, 10:30:00 to 10:30:00, 11:30:00 to 11:30:00, 12:55:00 to 12:55:00, 13:55:00 to 13:55:00, 14:55:00 to 14:55:00",,28.373863,-81.549329
Meet Princess Tiana and a Visiting Princess at Princess Fairytale Hall,Magic Kingdom Park,09:00:00 to 21:00:00,,28.4200458,-81.580917
Green Army Drum Corps,Disney's Hollywood Studios,"10:00:00 to 10:00:00, 11:00:00 to 11:00:00, 12:00:00 to 12:00:00, 14:00:00 to 14:00:00, 15:00:00 to 15:00:00, 16:00:00 to 16:00:00",,28.355815,-81.562344
Meet Beloved Disney Pals at Disney and Pixar Short Film Festival,EPCOT,"10:00:00 to 14:00:00, 15:00:00 to 17:15:00",['any-height'],28.37263,-81.55115
Disney Springs Kids Club,Disney Springs,,,28.37161,-81.518211
Beauty and the Beast – Live on Stage,Disney's Hollywood Studios,"11:00:00 to 11:00:00, 13:00:00 to 13:00:00, 14:00:00 to 14:00:00, 16:00:00 to 16:00:00, 17:00:00 to 17:00:00",,28.3589163,-81.559599
Meet Dashing Disney Pals as Circus Stars at Pete's Silly Sideshow,Magic Kingdom Park,10:00:00 to 19:00:00,,28.421282,-81.578932
Meet Characters from Aladdin in Adventureland,Magic Kingdom Park,"10:40:00 to 10:40:00, 11:55:00 to 11:55:00, 13:55:00 to 13:55:00, 15:00:00 to 15:00:00",,28.418658,-81.583513
Meet Disney Stars at Red Carpet Dreams,Disney's Hollywood Studios,09:00:00 to 20:00:00,,28.356068,-81.559479
Meet Mickey at Town Square Theater,Magic Kingdom Park,08:00:00 to 22:30:00,,28.416727,-81.580746
Disney® Visa® Cardmember Star Wars Photo Opportunity at Disney's Hollywood Studios,Disney's Hollywood Studios,11:00:00 to 16:00:00,,28.358061,-81.560933
Splitsville Luxury Lanes™,Disney Springs,11:00:00 to 23:00:00,,28.370157,-81.521325
Disney Enchantment at Disney After Hours at Magic Kingdom,Magic Kingdom Park,00:00:00 to 23:59:00,,28.419507,-81.581177
Donald's Dino-Bash!,Disney's Animal Kingdom Theme Park,,,28.356385,-81.587919
Meet Asha Near World Showcase Plaza,EPCOT,"09:30:00 to 09:30:00, 10:45:00 to 10:45:00, 11:55:00 to 11:55:00, 13:50:00 to 13:50:00, 15:00:00 to 15:00:00",['any-height'],28.3718773852161,-81.5488533162313
Meet Pixar Pals at Pixar Plaza,Disney's Hollywood Studios,,['any-height'],28.3563769305406,-81.5609562845992
Meet a Friend from the Hundred Acre Wood in the United Kingdom,EPCOT,"09:00:00 to 09:00:00, 09:30:00 to 09:30:00, 10:00:00 to 10:00:00, 10:30:00 to 10:30:00, 11:00:00 to 11:00:00, 11:30:00 to 11:30:00, 12:00:00 to 12:00:00, 13:40:00 to 13:40:00, 14:10:00 to 14:10:00, 14:40:00 to 14:40:00, 15:10:00 to 15:10:00, 15:40:00 to 15:40:00",,28.3707205104,-81.5524162352
Star Wars Launch Bay: Encounter Darth Vader,Disney's Hollywood Studios,10:00:00 to 18:00:00,,28.3581387982894,-81.5608885508893
Eat to the Beat Concert Series presented by Florida Blue Medicare,EPCOT,,,28.3682261910153,-81.5493872831897
Entertainment at Germany Gazebo,EPCOT,"12:40:00 to 12:40:00, 13:30:00 to 13:30:00, 14:35:00 to 14:35:00, 15:55:00 to 15:55:00, 17:00:00 to 17:00:00, 18:05:00 to 18:05:00",,28.368651,-81.546584
Disney Festival of Fantasy Parade,Magic Kingdom Park,"12:00:00 to 12:00:00, 15:00:00 to 15:00:00",,28.4189548,-81.581198
Feathered Friends in Flight!,Disney's Animal Kingdom Theme Park,"10:30:00 to 10:30:00, 11:30:00 to 11:30:00, 13:30:00 to 13:30:00, 14:30:00 to 14:30:00, 15:30:00 to 15:30:00",,28.358791,-81.590061
Meet Mulan in China,EPCOT,,,28.3698563364835,-81.5461904203374
Meet the Toys in Toy Story Land,Disney's Hollywood Studios,,,28.356184,-81.56207
Meet Ariel at Her Grotto,Magic Kingdom Park,10:00:00 to 19:00:00,,28.4208933,-81.579613
Mickey & Friends,,,,28.370176,-81.517283
Meet Disney Junior Pals in Animation Courtyard,Disney's Hollywood Studios,"09:30:00 to 09:30:00, 10:00:00 to 10:00:00, 10:30:00 to 10:30:00, 11:00:00 to 11:00:00, 11:30:00 to 11:30:00, 12:00:00 to 12:00:00, 12:30:00 to 12:30:00, 13:00:00 to 13:00:00, 13:30:00 to 13:30:00, 14:00:00 to 14:00:00, 14:30:00 to 14:30:00, 15:00:00 to 15:00:00, 15:30:00 to 15:30:00, 16:00:00 to 16:00:00, 16:30:00 to 16:30:00",,28.357822,-81.560658
Yehaa Bob Jackson at River Roost Lounge,Disney's Port Orleans Resort - Riverside,00:00:00 to 23:59:00,,28.3864921,-81.5369
Fantasmic!,Disney's Hollywood Studios,"20:30:00 to 20:30:00, 22:00:00 to 22:00:00",,28.3612252,-81.558233
Grand Floridian Lobby Pianist,Disney's Grand Floridian Resort & Spa,"15:00:00 to 15:00:00, 16:00:00 to 16:00:00, 17:00:00 to 17:00:00, 18:15:00 to 18:15:00, 19:15:00 to 19:15:00",,28.4109537,-81.587711
Wonderful World of Animation,Disney's Hollywood Studios,21:00:00 to 21:00:00,,28.356965,-81.560425
Sergio,EPCOT,00:00:00 to 23:59:00,,28.367692,-81.548249
Waterview Park,Disney Springs,,,28.37161,-81.518211
Disney Adventure Friends Cavalcade,Magic Kingdom Park,"17:10:00 to 17:10:00, 18:25:00 to 18:25:00",,28.419507,-81.581177
First Order Searches for the Resistance,Disney's Hollywood Studios,"11:30:00 to 11:30:00, 12:30:00 to 12:30:00, 13:30:00 to 13:30:00, 14:30:00 to 14:30:00, 16:30:00 to 16:30:00, 17:30:00 to 17:30:00, 18:30:00 to 18:30:00",,28.354335,-81.562562
Music of Mexico,EPCOT,,,28.370993,-81.547431
Animal Encounters: Winged Encounters – The Kingdom Takes Flight,Disney's Animal Kingdom Theme Park,"09:15:00 to 09:15:00, 10:15:00 to 10:15:00, 11:15:00 to 11:15:00, 13:15:00 to 13:15:00, 14:15:00 to 14:15:00, 15:15:00 to 15:15:00",,28.357339,-81.590462
Meet Daring Disney Pals as Circus Stars at Pete's Silly Sideshow,Magic Kingdom Park,10:00:00 to 19:00:00,,28.421282,-81.578932
Pixar,,,,28.370176,-81.517283
Meet Belle in France,EPCOT,"09:30:00 to 09:30:00, 10:45:00 to 10:45:00, 11:55:00 to 11:55:00, 13:50:00 to 13:50:00, 15:00:00 to 15:00:00",,28.36876,-81.55212
Disney® Visa® Cardmember Photo Opportunity at EPCOT,EPCOT,13:00:00 to 18:30:00,,28.37258,-81.550904
AdventHealth Waterside Stage,Disney Springs,,,28.37179,-81.51529
Meet Princess Aurora in France,EPCOT,"09:00:00 to 09:00:00, 10:15:00 to 10:15:00, 11:25:00 to 11:25:00, 13:20:00 to 13:20:00, 14:30:00 to 14:30:00",,28.36922,-81.55286
Disney Princesses at Walt Disney World Resort,,,,,
Viva Gaia Street Band!,Disney's Animal Kingdom Theme Park,"10:45:00 to 10:45:00, 11:45:00 to 11:45:00, 12:45:00 to 12:45:00, 14:00:00 to 14:00:00, 15:00:00 to 15:00:00, 16:00:00 to 16:00:00, 17:00:00 to 17:00:00",,28.357122,-81.589667
House of Blues,Disney Springs,,,28.370796,-81.521783
Meet Mirabel at Fairytale Garden – New!,Magic Kingdom Park,"09:00:00 to 09:00:00, 09:45:00 to 09:45:00, 10:30:00 to 10:30:00, 11:15:00 to 11:15:00, 12:00:00 to 12:00:00, 14:00:00 to 14:00:00, 14:45:00 to 14:45:00, 15:15:00 to 15:15:00, 15:45:00 to 15:45:00",,28.4195985,-81.580264
Casey's Corner Pianist,Magic Kingdom Park,"10:50:00 to 10:50:00, 11:35:00 to 11:35:00, 13:35:00 to 13:35:00, 14:35:00 to 14:35:00, 15:40:00 to 15:40:00, 16:40:00 to 16:40:00, 17:30:00 to 17:30:00",,28.418112,-81.581421
Star Wars Launch Bay: Meet Chewbacca,Disney's Hollywood Studios,10:00:00 to 18:00:00,,28.3580437948549,-81.5609857809673
Harambe Village Acrobats,Disney's Animal Kingdom Theme Park,"10:45:00 to 10:45:00, 11:45:00 to 11:45:00, 12:45:00 to 12:45:00, 13:45:00 to 13:45:00, 14:45:00 to 14:45:00, 15:45:00 to 15:45:00",,28.3591486373062,-81.5915742811563
Happily Ever After,Magic Kingdom Park,20:45:00 to 20:45:00,,28.419169,-81.581204
Meet Favorite Disney Pals at Adventurers Outpost,Disney's Animal Kingdom Theme Park,08:00:00 to 18:00:00,,28.357972,-81.589796
The Dapper Dans,Magic Kingdom Park,"09:00:00 to 09:00:00, 09:50:00 to 09:50:00, 10:40:00 to 10:40:00, 11:25:00 to 11:25:00, 13:15:00 to 13:15:00, 14:00:00 to 14:00:00, 15:40:00 to 15:40:00",,28.4174102,-81.581217
AMC® Disney Springs 24 Dine-In Theatres,Disney Springs,10:00:00 to 23:00:00,,28.37011,-81.520953
Voices of Liberty,EPCOT,"11:15:00 to 11:15:00, 12:00:00 to 12:00:00, 12:45:00 to 12:45:00, 13:30:00 to 13:30:00, 14:15:00 to 14:15:00, 15:00:00 to 15:00:00, 15:45:00 to 15:45:00",,28.367595,-81.549387
Meet Anna and Elsa at Royal Sommerhus,EPCOT,09:15:00 to 18:30:00,,28.37097,-81.547134
Electrical Water Pageant,The Campsites at Disney's Fort Wilderness Resort,20:25:00 to 22:30:00,,28.409698,-81.571398
Rose & Crown Pub Musician,EPCOT,"13:30:00 to 13:30:00, 14:30:00 to 14:30:00, 16:00:00 to 16:00:00, 17:00:00 to 17:00:00, 18:00:00 to 18:00:00, 19:00:00 to 19:00:00",,28.370467,-81.551677
Matsuriza,EPCOT,"11:00:00 to 11:00:00, 12:00:00 to 12:00:00, 13:00:00 to 13:00:00, 14:00:00 to 14:00:00, 15:00:00 to 15:00:00, 16:00:00 to 16:00:00, 16:45:00 to 16:45:00",,28.36786,-81.550389
Luminous The Symphony of Us – New!,EPCOT,21:00:00 to 21:00:00,,28.370146,-81.549394
Frozen Ever After,EPCOT,"08:30:00 to 09:00:00, 09:00:00 to 21:00:00",['any-height'],28.370745,-81.54653
Summit Plummet,Disney's Blizzard Beach Water Park,00:00:00 to 23:59:00,['48-inches-122-cm-or-taller'],28.3519232056,-81.5758319199
Discovery Island Trails,Disney's Animal Kingdom Theme Park,08:00:00 to 20:00:00,['any-height'],28.3581032852655,-81.5911151562868
Expedition Everest - Legend of the Forbidden Mountain,Disney's Animal Kingdom Theme Park,"07:30:00 to 08:00:00, 08:00:00 to 20:00:00",['44-inches-112-cm-or-taller'],28.3584769119,-81.5873781396
Gangplank Falls,Disney's Typhoon Lagoon Water Park,10:00:00 to 18:00:00,['any-height'],28.3657380338,-81.5305508673
Butterflies - Disney Animals,Disney's Animal Kingdom Theme Park,,['any-height'],28.3649980475451,-81.5890323591127
Star Wars: Rise of the Resistance,Disney's Hollywood Studios,"08:30:00 to 09:00:00, 09:00:00 to 21:30:00",['40-inches-102-cm-or-taller'],28.354884,-81.560457
Gran Fiesta Tour Starring The Three Caballeros,EPCOT,09:00:00 to 21:00:00,['any-height'],28.371649,-81.547368
Tree of Life,Disney's Animal Kingdom Theme Park,,['any-height'],28.357994,-81.590597
Mickey's PhilharMagic,Magic Kingdom Park,"07:30:00 to 08:00:00, 08:00:00 to 23:00:00",['any-height'],28.4200304909,-81.5814839853
Disney Fab 50 Character Collection,Magic Kingdom Park,,['any-height'],28.4194549043,-81.5811809
Guardians of the Galaxy: Cosmic Rewind,EPCOT,09:00:00 to 21:00:00,['42-inches-107-cm-or-taller'],28.3749021961781,-81.5478397673417
Crush 'n' Gusher,Disney's Typhoon Lagoon Water Park,10:00:00 to 18:00:00,['48-inches-122-cm-or-taller'],28.3666932987,-81.5282974765
Avatar Flight of Passage,Disney's Animal Kingdom Theme Park,"07:30:00 to 08:00:00, 08:00:00 to 20:00:00",['44-inches-112-cm-or-taller'],28.355554,-81.592147
Runoff Rapids,Disney's Blizzard Beach Water Park,00:00:00 to 23:59:00,['any-height'],28.351462,-81.576098
Rhinos - Disney Animals,Disney's Animal Kingdom Theme Park,,['any-height'],28.359414,-81.592356
Storm Slides,Disney's Typhoon Lagoon Water Park,10:00:00 to 18:00:00,['any-height'],28.366791097,-81.5304308189
The Twilight Zone Tower of Terror™,Disney's Hollywood Studios,"08:30:00 to 09:00:00, 09:00:00 to 21:30:00",['40-inches-102-cm-or-taller'],28.359553,-81.559772
Migratory Birds - Disney Animals,Disney's Animal Kingdom Theme Park,,['any-height'],28.355674,-81.590191
Disney Springs Art Walk: A Canvas of Expression,Disney Springs,,,28.369968,-81.517103
Millennium Falcon: Smugglers Run,Disney's Hollywood Studios,"08:30:00 to 09:00:00, 09:00:00 to 21:30:00",['38-inches-97-cm-or-taller'],28.353889,-81.561689
Coca-Cola Polar Bear Photo Op Experience,Disney Springs,,['any-height'],28.369329,-81.519149
The Hall of Presidents,Magic Kingdom Park,08:00:00 to 22:00:00,['any-height'],28.4194484171,-81.5823248578
Rock 'n' Roller Coaster Starring Aerosmith,Disney's Hollywood Studios,00:00:00 to 23:59:00,['48-inches-122-cm-or-taller'],28.359712,-81.56059
Buzz Lightyear's Space Ranger Spin,Magic Kingdom Park,"07:30:00 to 08:00:00, 08:00:00 to 23:00:00",['any-height'],28.4182868839,-81.5794086456
Downhill Double Dipper,Disney's Blizzard Beach Water Park,00:00:00 to 23:59:00,['48-inches-122-cm-or-taller'],28.351215713,-81.5756836496
African Elephants - Disney Animals,Disney's Animal Kingdom Theme Park,,['any-height'],28.359414,-81.592318
Marketplace Train Express,Disney Springs,10:00:00 to 23:00:00,['any-height'],28.372459,-81.51473
Liberty Square Riverboat,Magic Kingdom Park,11:00:00 to 19:00:00,['any-height'],28.4195563399,-81.5827982677
Bruce's Shark World,EPCOT,09:00:00 to 21:00:00,['any-height'],28.375099,-81.551245451
Awesome Planet,EPCOT,09:00:00 to 21:00:00,['any-height'],28.374301,-81.552138
Sharks and Rays - Disney Animals,EPCOT,,['any-height'],28.375631,-81.550904
Star Tours – The Adventures Continue,Disney's Hollywood Studios,"08:30:00 to 09:00:00, 09:00:00 to 21:30:00",['40-inches-102-cm-or-taller'],28.355695,-81.558891
The Oasis Exhibits,Disney's Animal Kingdom Theme Park,08:00:00 to 20:00:00,['any-height'],28.355965,-81.59014
Stave Church Gallery,EPCOT,09:00:00 to 21:00:00,['any-height'],28.370621,-81.546971
Dumbo the Flying Elephant,Magic Kingdom Park,"07:30:00 to 08:00:00, 08:00:00 to 23:00:00",['any-height'],28.420509033,-81.5789473057
African Lions - Disney Animals,Disney's Animal Kingdom Theme Park,,['any-height'],28.359414,-81.592273
Babirusas - Disney Animals,Disney's Animal Kingdom Theme Park,,['any-height'],28.3561095970354,-81.5899304157241
Ski Patrol Training Camp,Disney's Blizzard Beach Water Park,00:00:00 to 23:59:00,['any-height'],28.352258,-81.575348
Gallery of Arts and History,EPCOT,09:00:00 to 21:00:00,['any-height'],28.368236,-81.551612
Affection Section,Disney's Animal Kingdom Theme Park,09:30:00 to 17:00:00,['any-height'],28.3653458262,-81.5888520134
Hippopotamuses - Disney Animals,Disney's Animal Kingdom Theme Park,,['any-height'],28.359414,-81.592199
EPCOT International Flower & Garden Festival - Topiaries,EPCOT,,['any-height'],28.371939491566557,-81.54942879960687
Haunted Mansion,Magic Kingdom Park,08:00:00 to 23:00:00,['any-height'],28.4202,-81.58288
SeaBase,EPCOT,"08:30:00 to 09:00:00, 09:00:00 to 21:00:00",['any-height'],28.375098,-81.551211
African Birds - Disney Animals,Disney's Animal Kingdom Theme Park,,['any-height'],28.360227,-81.59354
Sea Turtles - Disney Animals,EPCOT,,['any-height'],28.375631,-81.550828
Star Wars: Datapad on Play Disney Parks Mobile App,,,,,
Vintage Amphicar Tours,Disney Springs,10:00:00 to 22:00:00,['any-height'],28.37167,-81.517986
Snow Stormers,Disney's Blizzard Beach Water Park,00:00:00 to 23:59:00,['any-height'],28.3514397089,-81.5756890923
The American Adventure,EPCOT,"11:45:00 to 11:45:00, 12:30:00 to 12:30:00, 13:15:00 to 13:15:00, 14:00:00 to 14:00:00, 14:45:00 to 14:45:00, 15:30:00 to 15:30:00, 16:30:00 to 16:30:00, 17:30:00 to 17:30:00, 18:30:00 to 18:30:00, 19:30:00 to 19:30:00",['any-height'],28.367517,-81.549446
Turtle Talk With Crush,EPCOT,09:40:00 to 20:40:00,['any-height'],28.375255,-81.551047
Aerophile – The World Leader in Balloon Flight,Disney Springs,09:30:00 to 23:00:00,['any-height'],28.370954,-81.519473
Walt Disney's Enchanted Tiki Room,Magic Kingdom Park,08:00:00 to 23:00:00,['any-height'],28.4182264646,-81.583738382
Big Thunder Mountain Railroad,Magic Kingdom Park,08:00:00 to 23:00:00,['40-inches-102-cm-or-taller'],28.4199638504,-81.5846422864
Cinderella Castle Mural of Memories,Magic Kingdom Park,,,28.418608,-81.581198
Bijutsu-kan Gallery,EPCOT,09:00:00 to 21:00:00,['any-height'],28.367309,-81.550525
Anteaters - Disney Animals,Disney's Animal Kingdom Theme Park,,['any-height'],28.3561578052496,-81.5906228511836
Star Wars™ at Walt Disney World Resort,Disney's Hollywood Studios,,,,
Frontierland Shootin' Arcade,Magic Kingdom Park,08:00:00 to 23:00:00,['any-height'],28.4187637244,-81.5832274211
Disney’s DuckTales World Showcase Adventure,EPCOT,09:00:00 to 21:00:00,['any-height'],28.3707609,-81.552322
Fossil Fun Games,Disney's Animal Kingdom Theme Park,09:30:00 to 18:00:00,['any-height'],28.35677,-81.587961
Conservation Station,Disney's Animal Kingdom Theme Park,09:30:00 to 17:00:00,['any-height'],28.36533,-81.58872
Space Mountain,Magic Kingdom Park,"07:30:00 to 08:00:00, 08:00:00 to 23:00:00",['44-inches-112-cm-or-taller'],28.4188341691,-81.5781962872
Gibbons - Disney Animals,Disney's Animal Kingdom Theme Park,,['any-height'],28.359049,-81.58874
Mad Tea Party,Magic Kingdom Park,"07:30:00 to 08:00:00, 08:00:00 to 23:00:00",['any-height'],28.4200230397,-81.5798248916
Canada Far and Wide in Circle-Vision 360,EPCOT,09:00:00 to 21:00:00,['any-height'],28.371694,-81.55196
Toy Story Mania!,Disney's Hollywood Studios,"08:30:00 to 09:00:00, 09:00:00 to 21:30:00",['any-height'],28.356404,-81.561894
Flamingos at Discovery Island - Disney Animals,Disney's Animal Kingdom Theme Park,,['any-height'],28.357587,-81.591099
Wilderness Explorers,Disney's Animal Kingdom Theme Park,09:00:00 to 18:30:00,['any-height'],28.356682,-81.590292
Advanced Training Lab,EPCOT,12:00:00 to 18:00:00,['any-height'],28.374185,-81.547072
Mickey & Minnie's Runaway Railway,Disney's Hollywood Studios,"08:30:00 to 09:00:00, 09:00:00 to 21:30:00",['any-height'],28.3566783801,-81.5605667783
Test Track,EPCOT,"08:30:00 to 09:00:00, 09:00:00 to 21:00:00",['40-inches-102-cm-or-taller'],28.373228,-81.547489
Wildlife Express Train,Disney's Animal Kingdom Theme Park,09:30:00 to 16:30:00,['any-height'],28.3598097347,-81.5914175464
American Heritage Gallery,EPCOT,09:00:00 to 21:00:00,['any-height'],28.367517,-81.549469
Ketchakiddee Creek,Disney's Typhoon Lagoon Water Park,10:00:00 to 18:00:00,['48-inches-122-cm-or-shorter'],28.36507,-81.530505
Under the Sea - Journey of The Little Mermaid,Magic Kingdom Park,"07:30:00 to 08:00:00, 08:00:00 to 23:00:00",['any-height'],28.4211203,-81.579975
Star Wars Launch Bay Theater - Temporarily Unavailable,Disney's Hollywood Studios,00:00:00 to 23:59:00,['any-height'],28.357821,-81.561061
Pirates at Walt Disney World Resort,Magic Kingdom Park,,,,
Astro Orbiter,Magic Kingdom Park,"07:30:00 to 08:00:00, 08:00:00 to 23:00:00",['any-height'],28.4184926179,-81.5789887902
Mexico Folk Art Gallery,EPCOT,09:00:00 to 21:00:00,['any-height'],28.371511,-81.54746
Toboggan Racers,Disney's Blizzard Beach Water Park,00:00:00 to 23:59:00,['any-height'],28.351715,-81.575773
DINOSAUR,Disney's Animal Kingdom Theme Park,"07:30:00 to 08:00:00, 08:00:00 to 20:00:00",['40-inches-102-cm-or-taller'],28.355307,-81.588444
Alien Swirling Saucers,Disney's Hollywood Studios,"08:30:00 to 09:00:00, 09:00:00 to 21:30:00",['32-inches-81-cm-or-taller'],28.355385,-81.562379
Castaway Creek,Disney's Typhoon Lagoon Water Park,10:00:00 to 18:00:00,['any-height'],28.3660367345,-81.5287544578
Bats - Disney Animals,Disney's Animal Kingdom Theme Park,,['any-height'],28.3596505545806,-81.589561814223
Gorillas - Disney Animals,Disney's Animal Kingdom Theme Park,,['any-height'],28.360758,-81.593059
House of the Whispering Willows,EPCOT,09:00:00 to 21:00:00,['any-height'],28.36999,-81.546334
Prince Charming Regal Carrousel,Magic Kingdom Park,"07:30:00 to 08:00:00, 08:00:00 to 23:00:00",['any-height'],28.420169,-81.581255
Reflections of China,EPCOT,09:00:00 to 21:00:00,['any-height'],28.369791,-81.546381
Typhoon Lagoon Surf Pool,Disney's Typhoon Lagoon Water Park,10:00:00 to 18:00:00,['any-height'],28.3659144638,-81.5299641145
Maharajah Jungle Trek,Disney's Animal Kingdom Theme Park,09:00:00 to 18:30:00,['any-height'],28.359379,-81.589019
The Magic Carpets of Aladdin,Magic Kingdom Park,08:00:00 to 23:00:00,['any-height'],28.41843,-81.583472
Walt Disney World Railroad - Frontierland,Magic Kingdom Park,09:00:00 to 19:00:00,['any-height'],28.41969,-81.585078
TRON Lightcycle / Run,Magic Kingdom Park,08:00:00 to 23:00:00,['48-inches-122-cm-or-taller'],28.419625,-81.577985
Soarin' Around the World,EPCOT,"08:30:00 to 09:00:00, 09:00:00 to 21:00:00",['40-inches-102-cm-or-taller'],28.373592,-81.552248
Na'vi River Journey,Disney's Animal Kingdom Theme Park,"07:30:00 to 08:00:00, 08:00:00 to 20:00:00",['any-height'],28.355257,-81.591641
Vultures - Disney Animals,Disney's Animal Kingdom Theme Park,,,28.357602,-81.590752
Frozen at Walt Disney World Resort,EPCOT,,['any-height'],,
Invertebrates - Disney Animals,Disney's Animal Kingdom Theme Park,,['any-height'],28.355478,-81.590128
Lemurs - Disney Animals,Disney's Animal Kingdom Theme Park,,['any-height'],28.357555,-81.590224
Keelhaul Falls,Disney's Typhoon Lagoon Water Park,10:00:00 to 18:00:00,['any-height'],28.3654943759,-81.5305106342
Lightning McQueen's Racing Academy,Disney's Hollywood Studios,09:00:00 to 20:30:00,['any-height'],28.360035,-81.560707
Zebras - Disney Animals,Disney's Animal Kingdom Theme Park,,['any-height'],28.355478,-81.590106
